1995,Dexamethasone inhibits ozone-induced gene expression of macrophage inflammatory protein-2 in rat lung,"Haddah E.-B., Salmon M., Sun J., Liu S., Das A., Adcock I., Barnes P.J., Chung K.F.",145793,FEBS Letters,363,3,22,1,0,1,0,23
1995,High concentrations of ?-adrenergic agonists inhibit DNA binding of glucocorticoids in human lung in vitro,"Adcock I.M., Peters M.J., Brown C.R., Stevens D.A., Barnes P.J.",3005127,Biochemical Society Transactions,23,2,3,0,0,0,0,3
1994,Effects of dexamethasone on cytokine and phorbol ester stimulated c-Fos and c-Jun DNA binding and gene expression in human lung,"Adcock I.M., Brown C.R., Shirasaki H., Barnes P.J.",9031936,European Respiratory Journal,7,12,36,0,1,1,0,37
1994,The effects of glucocorticoids on phorbol ester and cytokine stimulated transcription factor activation in human lung,"Adcock I.M., Shirasaki H., Gelder C.M., Peters M.J., Brown C.R., Barnes P.J.",243205,Life Sciences,55,14,60,1,2,3,0,63
1994,Agonist-induced up-regulation of platelet-activating factor receptor messenger RNA in human monocytes,"Shirasaki H., Adcock I.M., Kwon O.J., Nishikawa M., Mak J.C., Barnes P.J.",9224106,European Journal of Pharmacology - Molecular Pharmacology Section,268,2,13,1,1,2,0,15
1994,Induction of the interleukin-1 decoy receptor by glucocorticoids [3],"Colotta F., Mantovani A., Barnes P.J., Adcock I.M.",1656147,Trends in Pharmacological Sciences,15,5,5,0,0,0,0,5
1994,Barnes and Adcock reply,"Barnes P.J., Adcock I.M.",1656147,Trends in Pharmacological Sciences,15,5,0,0,0,0,0,0
1994,Expression of platelet-activating factor receptor mRNA in human and guinea pig lung.,"Shirasaki H., Nishikawa M., Adcock I.M., Mak J.C., Sakamoto T., Shimizu T., Barnes P.J.",10441549,American journal of respiratory cell and molecular biology,10,5,22,0,2,2,0,24
1994,Dexamethasone action on c-fos and c-jun mRNA and protein in human lung,"Adcock I.M., Brown C.R., Barnes P.J.",3005127,Biochemical Society Transactions,22,2,0,0,0,0,0,0
1994,Oxidative stress induces NF?B DNA binding and inducible NOS mRNA in the human epithelial cell line A549,"Adcock I.M., Brown C.R., Kwon O., Barnes P.J.",3005127,Biochemical Society Transactions,22,2,3,0,1,1,0,4
1994,Inhibition of interleukin-8 expression by dexamethasone in human cultured airway epithelial cells,"Kwon O.J., Au B.T., Collins P.D., Baraniuk J.N., Adcock I.M., Chung K.F., Barnes P.J.",192805,Immunology,81,3,77,5,1,6,0,83
1994,Tumor necrosis factor-induced interleukin-8 expression in cultured human airway epithelial cells,"Kwon Jung O., Au Bo T., Collins P.D., Adcock I.M., Mak J.C., Robbins R.R., Chung Fan K., Barnes P.J.",29513,AM.J.PHYSIOL.,267,4,35,1,2,3,1,39
1994,Tumor necrosis factor-induced interleukin-8 expression in cultured human airway epithelial cells,"O Jung Kwon, Au B.T., Collins P.D., Adcock I.M., Mak J.C., Robbins R.R., Chung K.F., Barnes P.J.",10400605,American Journal of Physiology - Lung Cellular and Molecular Physiology,267,4,46,1,2,3,0,49
1994,Oxidative stress induces NF?B DNA binding and inducible NOS mRNA in human epithelial cells,"Adcock I.M., Brown C.R., Kwon O., Barnes P.J.",0006291X,Biochemical and Biophysical Research Communications,199,3,168,3,4,7,3,178
1994,Endotoxin and steroid effects on nitric oxide synthase mRNA expression in rat lung and other tissues,"Adcock I.M., Liu S., Brown C.R., Evans T.W., Barnes P.J.",3005127,Biochemical Society Transactions,22,2,9,0,0,0,0,9
1994,Eotaxin: Cloning of an eosinophil chemoattractant cytokine and increased mRNA expression in allergen-challenged guinea-pig lungs,"Jose P.J., Adcock I.M., Griffiths-Johnson D.A., Berkman N., Wells T.N.C., Williams T.J., Power c. A.",0006291X,Biochemical and Biophysical Research Communications,205,1,113,2,4,6,1,120
1994,Inducible nitric oxide synthase is increased in murine lung epithelial cells by cytokine stimulation,"Robbins R.A., Polak J., Barnes P.J., Springall D.R., Warren J.B., Kwon O.J., Buttery L.D.K., Wilson A.J., Adcock I.M., Riveros-Moreno V., Moncada S.",0006291X,Biochemical and Biophysical Research Communications,198,3,114,5,2,7,1,122
1993,Anti-inflammatory actions of steroids: Molecular mechanisms,"Barnes P.J., Adcock I.",1656147,Trends in Pharmacological Sciences,14,12,424,19,11,30,5,459
1993,Transcription factor interactions in human lung,"Adcock I.M., Peters M.J., Brown C.R., Gelder C.M., Barnes P.J.",3005127,Biochemical Society Transactions,21,3,2,0,0,0,0,2
1993,Increased tachykinin receptor gene expression in asthmatic lung and its modulation by steroids,"Adcock I.M., Peters M., Gelder C., Shirasaki H., Brown C.R., Barnes P.J.",9525041,Journal of Molecular Endocrinology,11,1,82,4,3,7,2,91
1993,Lipopolysaccharide treatment in vivo induces widespread tissue expression of inducible nitric oxide synthase mRNA,"Liu S., Adcock I.M., Old R.W., Barnes P.J., Evans T.W.",0006291X,Biochemical and Biophysical Research Communications,196,3,200,11,5,16,1,217
1991,Expression of honeybee prepromelittin as a fusion protein in Escherichia coli,"He M., Adcock I., Chapman D., Lucy J., Austen B.",10465928,Protein Expression and Purification,2, 5-6,1,0,0,0,0,1
1991,An improved and rapid procedure for isolating RNA-free Escherichia coli plasmid DNA,"He M., Kaderbhai M.A., Adcock I., Austen B.M.",10503862,Genetic Analysis Techniques and Applications,8,3,3,0,0,0,0,3
1991,An improved and rapid procedure for isolating RNA-Free Escherichia coli plasmid DNA,"Mingyue He, Kaderbhai M.A., Adcock I., Austen B.M.",10503862,Genetic Analysis: Biomolecular Engineering,8,3,0,0,0,0,0,0
1989,Oestrogen receptors and effects of oestradiol administration on mRNA synthesis in the limbic system of the neonatal female rat,"Greenstein B.D., Adcock I.M.",220795,Journal of Endocrinology,120,1,3,0,0,0,0,3
1989,Interactions of signal and transit peptides with membrane proteins and phospholipids,"Adcock I., Westwood O., Austen B.",3005127,Biochemical Society Transactions,17,5,0,0,0,0,0,0
1986,Sexual dimorphism of messenger RNA isolated from neonatal rat brain,"Adcock I.M., Greenstein B.D.",220795,Journal of Endocrinology,109,1,1,0,0,0,0,1
1986,Reappearance of the thymus in old rats after orchidectomy: Inhibition of regeneration by testosterone,"Greenstein B.D., Fitzpatrick F.T.A., Adcock I.M.",220795,Journal of Endocrinology,110,3,50,7,5,12,2,64
