,"This is a citation overview for a set of 27 documents.",,,,,,,,,,,
,,,,,,,,,,,,
,"h index = 13 (Of the 27 documents considered for the h-Index, 13 have been cited at least 13 times.)",,,,,,,,,,,
,Note: Scopus does not have complete citation information for articles published before 1996.  ,,,,,,,,,,,
,,,,,,,,,,,,
,,,,,,,<2007,2007,2008,subtotal,>2008,total
Publication Year,Document Title,Authors,ISSN,Journal Title,Volume,Issue,679,103,131,234,64,977
2009,"The skeletal phenotypes of TR? and TB? mutant mice","Bassett J.H.D., Williams G.R.",09525041,"Journal of Molecular Endocrinology",42, 4,0,0,0,0,0,0
2008,"Critical role of the hypothalamic-pituitary-thyroid axis in bone","Bassett J.H.D., Williams G.R.",87563282,"Bone",43, 3,0,0,0,0,5,5
2008,"Intrauterine transplantation of human fetal mesenchymal stem cells from first-trimester blood repairs bone and reduces fractures in osteogenesis imperfecta mice","Guillot P.V., Fisk N.M., Abass O., Bassett J.H.D., Shefelbine S.J., Bou-Gharios G., Chan J., Kurata H., Williams G.R., Polak J.",00064971,"Blood",111, 3,0,0,8,8,8,16
2008,"A lack of thyroid hormones rather than excess thyrotropin causes abnormal skeletal development in hypothyroidism","Bassett J.H.D., Costagliola S., Vassart G., Weiss R.E., Refetoff S., Williams G.R., Williams A.J., Murphy E., Boyde A., Howell P.G.T., Swinhoe R., Archanco M., Flamant F., Samarut J.",08888809,"Molecular Endocrinology",22, 2,0,0,5,5,3,8
2007,"Thyroid status during skeletal development determines adult bone structure and mineralization","Bassett J.H.D., Nordstrom K., Boyde A., Howell P.G.T., Kelly S., Vennstrom B., Williams G.R.",08888809,"Molecular Endocrinology",21, 8,0,1,9,10,3,13
2007,"Thyroid hormone excess rather than thyrotropin deficiency induces osteoporosis in hyperthyroidism","Bassett J.H.D., Clement-Lacroix P., Samarut J., Chassande O., Williams G.R., O'Shea P.J., Sriskantharajah S., Rabier B., Boyde A., Howell P.G.T., Weiss R.E., Roux J.-P., Malaval L.",08888809,"Molecular Endocrinology",21, 5,0,7,14,21,4,25
2007,"The rat thyroid hormone receptor (TR) ??3 displays cell-, TR isoform-, and thyroid hormone response element-specific actions","Harvey C.B., Bassett J.H.D., Maruvada P., Yen P.M., Williams G.R.",00137227,"Endocrinology",148, 4,0,1,4,5,0,5
2006,"Disorders of calcium","Murphy E., Bassett J.H.D., Williams G.R.",00326518,"Practitioner",250, 1686,0,0,0,0,0,0
2006,"Thyroid hormone regulates heparan sulfate proteoglycan expression in the growth plate","Bassett J.H.D., Swinhoe R., Chassande O., Samarut J., Williams G.R.",00137227,"Endocrinology",147, 1,1,1,1,2,1,4
2005,"Effects of thyroid status on bone metabolism: a primary role for thyroid stimulating hormone or thyroid hormone?","Galliford T.M., Murphy E., Williams A.J., Bassett J.H., Williams G.R.",03911977,"Minerva endocrinologica.",30, 4,0,2,4,6,0,6
2005,"Contrasting skeletal phenotypes in mice with an identical mutation targeted to thyroid hormone receptor ?1 or ?","O'Shea P.J., Bassett J.H.D., Sriskantharajah S., Ying H., Cheng S.-Y., Williams G.R.",08888809,"Molecular Endocrinology",19, 12,4,8,7,15,4,23
2005,"Thyroid hormones regulate fibroblast growth factor receptor signaling during chondrogenesis","Barnard J.C., Williams A.J., Rabier B., Chassande O., Samarut J., Cheng S.-Y., Bassett J.H.D., Williams G.R.",00137227,"Endocrinology",146, 12,3,5,5,10,1,14
2004,"A tense case - Carney's triad","Bladen J.C., Moosajee M., Bassett J.H.D.",01410768,"Journal of the Royal Society of Medicine",97, 11,0,1,0,1,1,2
2003,"Mechanisms of thyroid hormone receptor-specific nuclear and extra nuclear actions","Bassett J.H.D., Harvey C.B., Williams G.R.",03037207,"Molecular and Cellular Endocrinology",213, 1,50,30,20,50,11,111
2003,"The molecular actions of thyroid hormone in bone","Bassett J.H.D., Williams G.R.",10432760,"Trends in Endocrinology and Metabolism",14, 8,25,14,21,35,3,63
2003,"Multiple endocrine neoplasia type 1 (MEN1) germline mutations in familial isolated primary hyperparathyroidism","Pannett A.A.J., Flinter F., Maidment C.G.H., Trembath R., Thakker R.V., Kennedy A.M., Turner J.J.O., Forbes S.A., Cavaco B.M., Bassett J.H.D., Cianferotti L., Harding B., Shine B.",03000664,"Clinical Endocrinology",58, 5,22,3,3,6,2,30
1999,"Novel DAX1 mutations in X-linked adrenal hypoplasia congenita and hypogonadotrophic hypogonadism","Bassett J.H.D., O'Halloran D.J., Williams G.R., Beardwell C.G., Shalet S.M., Thakker R.V.",03000664,"Clinical Endocrinology",50, 1,23,2,1,3,0,26
1999,"Studies of the murine homolog of the multiple endocrine neoplasia type 1 (MEN1) gene, men1","Bassett J.H.D., Rashbass P., Harding B., Forbes S.A., Pannett A.A.J., Thakker R.V.",08840431,"Journal of Bone and Mineral Research",14, 1,27,1,2,3,1,31
1998,"The search for the MEN1 gene","Lemmes I., Caldener A., Parente F., Quincey D., Courseaux A., Carle G.F., Gaudray P., De Wit M.J., Lips C.J.M., Hoppener J.W.M., Khodaei S., Van De Ven W.J.M., Grant A.L., Weber G., Teh B.T., Farnebo F., Kytola S., Grimmond S., Phelan C., Larsson C., Bassett J.H.D., Forbes S.A., Kas K., Pannett A.A.J., Thakker R.V., Zhang C.X., Giraud S., Wautot V., Buisson N., Pugeat M., Peix J.-L.",09546820,"Journal of Internal Medicine",243, 6,7,0,1,1,0,8
1998,"A putative human zinc-finger gene (ZFPL1) on 11q13, highly conserved in the mouse and expressed in exocrine pancreas. The European consortium on MEN 1","Hoppener J.W.M., Khodaei S., Weber G., Teh B., Farnebo F., Larsson C., Zhang C.X., Calender A., Pannett A.A.J., Forbes S.A., Bassett J.H.D., De Wit M.J., Thakker R.V., Lemmens I., Van De Ven W.J.M., Kas K., Simarro-Doorten A.Y., Roijers J.F.M., Van Herrewaarden H.M.C., Lips C.J.M., Parente F., Quincey D., Gaudray P.",08887543,"Genomics",50, 2,0,0,1,1,0,1
1998,"Characterization of mutations in patients with multiple endocrine neoplasia type 1","Bassett J.H.D., Monson J.P., Sampson J., Wass J.A.H., Wheeler M.H., Thakker R.V., Forbes S.A., Pannett A.A.J., Lloyd S.E., Christie P.T., Wooding C., Harding B., Besser G.M., Edwards C.R.",00029297,"American Journal of Human Genetics",62, 2,189,13,12,25,6,220
1997,"Linkage disequilibrium studies in multiple endocrine neoplasia type 1 (MEN1)","Bassett J.H.D., Leisti J., Salmela P., Weber G., Giraud S., Zhang C.X., Calender A., Hoppener J.W.M., Ploos van Amstel H.K., Lips C.J.M., Kas K., Pannett A.A.J., Van de Yen W.J.M., Gaudray P., Forbes S.A., Thakker R.V., McCarthy M., Read A.P., Teh B.T., Larsson C., Kytola S.",03406717,"Human Genetics",100, 5-6,12,0,1,1,0,13
1997,"Construction of a 1.2-Mb sequence-ready contig of chromosome 11q13 encompassing the multiple endocrine neoplasia type 1 (MEN1) gene","Lemmens I., Salandre J., Lenoir G., Calender A., Parente F., Quincey D., Courseaux A., Carle G.F., Gaudray P., De Wit M.J., Lips C.J.M., Merregaert J., Hoppener J.W.M., Khodaei S., Grant A.L., Weber G., Kytola S., Teh B.T., Farnebo F., Grimmond S., Phelan C., Larsson C., Van De Ven W.J.M., Forbes S.A., Bassett J.H.D., Pannett A.A.J., Thakker R.V., Koen K., Zhang C.X., Giraud S., Wautot V., Buisson N., De Witte K.",08887543,"Genomics",44, 1,18,0,0,0,1,19
1997,"Identification of the multiple endocrine neoplasia type 1 (MEN1) gene","Lemmens I., Lenoir G., Pugeat M., Calender A., Parente F., Quincey D., Gaudray P., De Wit M.J., Lips C.J.M., Hoppener J.W.M., Khodaei S., Van De Ven Wim J.M., Grant A.L., Weber G., Kytola S., Teh B.T., Farnebo F., Phelan C., Hayward N., Larsson C., Pannett A.A.J., Forbes S.A., Kas K., Bassett J.H.D., Thakker R.V., Zhang C.X., Giraud S., Wautot V., Buisson N., De Witte K., Salandre J.",09646906,"Human Molecular Genetics",6, 7,281,14,12,26,9,316
1997,"The European Consortium on MEN1. Mapping of the gene encoding the B56? subunit of protein phosphatase 2A (PPP2R5B) to a 0.5-Mb region of chromosome 11q13 and its exclusion as a candidate gene for multiple endocrine neoplasia type 1 (MEN1)","Forbes S.A., Gaudray P., Weber G., Larsson C., Zhang C.X., Calender A., Hoppener J.W.M., Lips C.J.M., Kas K., Pannett A.A.J., Bassett J.H.D., Harding B., Wooding C., Thakker R.V., Butler R., Ogilvie D., Anand R.",03406717,"Human Genetics",100, 3-4,1,0,0,0,0,1
1995,"Molecular genetics of disorders of calcium homeostasis","Bassett J.H.D., Thakker R.V.",0950351X,"Bailliere's Clinical Endocrinology and Metabolism",9, 3,10,0,0,0,1,11
1991,"Linear order of new and established DNA markers around the fragile site at Xq27.3","Hirst M.C., Boyd Y., Thomas N.S.T., Knight S.J.L., Warren S.T., Hors-Cayla M., Schmidt M., Sutherland G.R., Davies K.E., Roche A., Flint T.J., MacKinnon R.N., Bassett J.H.D., Nakahori Y., Watson J.E.V., Bell M.V., Patterson M.N.",08887543,"Genomics",10, 1,6,0,0,0,0,6
