,"Author: Curtin, Nancy A.",,,,,,,,,,,
,,,,,,,,,,,,
,"h index = 11 (Of the 33 documents considered for the h-Index, 11 have been cited at least 11 times.)",,,,,,,,,,,
,Note: The h Index considers Scopus documents published after 1995.  ,,,,,,,,,,,
,,,,,,,,,,,,
,,,,,,,<2007,2007,2008,subtotal,>2008,total
Publication Year,Document Title,Authors,ISSN,Journal Title,Volume,Issue,513,52,54,106,37,656
2009,"Temperature change as a probe of muscle crossbridge kinetics: A review and discussion","Woledge R.C., Barclay C.J., Curtin N.A.",09628452,"Proceedings of the Royal Society B: Biological Sciences",276, 1668,0,0,0,0,0,0
2009,"Adeno-associated virus-8-mediated intravenous transfer of myostatin propeptide leads to systemic functional improvements of slow but not fast muscle","Foster K., Kawar S.L., Patel K., Dickson G., Graham I.R., Otto A., Foster H., Trollet C., Yaworsky P.J., Walsh F.S., Bickham D., Curtin N.A.",15491684,"Rejuvenation Research",12, 2,0,0,0,0,2,2
2009,"Effects of UCP3 genotype, temperature and muscle type on energy turnover of resting mouse skeletal muscle","Barclay C.J., Woledge R.C., Curtin N.A.",00316768,"Pflugers Archiv European Journal of Physiology",457, 4,0,0,0,0,0,0
2008,"The energetic cost of activation in mouse fast-twitch muscle is the same whether measured using reduced filament overlap or N-benzyl-p- toluenesulphonamide","Barclay C.J., Lichtwark G.A., Curtin N.A.",17481708,"Acta Physiologica",193, 4,0,0,0,0,3,3
2007,"Energy turnover for Ca2+ cycling in skeletal muscle","Barclay C.J., Woledge R.C., Curtin N.A.",01424319,"Journal of Muscle Research and Cell Motility",28, 4-5,0,0,2,2,3,5
2005,"Influence of ionic strength on the time course of force development and phosphate release by dogfish muscle fibres","West T.G., Ferenczi M.A., Woledge R.C., Curtin N.A.",00223751,"Journal of Physiology",567, 3,1,2,0,2,2,5
2005,"Muscle directly meets the vast power demands in agile lizards","Curtin N.A., Woledge R.C., Aerts P.",09628436,"Proceedings of the Royal Society B: Biological Sciences",272, 1563,4,3,1,4,1,9
2005,"Predicting red muscle performance","Curtin N.A., Lou F., Woledge R.C.",15707555,"Animal Biology",55, 1,0,0,0,0,0,0
2004,"General discussion part III","Woledge R.C., Curtin N.A., Rall J.A.",00652598,"Advances in Experimental Medicine and Biology",538, ,0,0,0,0,0,0
2004,"Rate of actomyosin ATP hydrolysis diminishes during isometric contraction","Curtin N.A., West T.G., Ferenczi M.A., He Z.-H., Sun Y.-B., Irving M., Woledge R.C.",00652598,"Advances in Experimental Medicine and Biology",538, ,1,0,0,0,0,1
2004,"Energy storage during stretch of active single fibres","Woledge R.C., Curtin N.A., Linari M.",00652598,"Advances in Experimental Medicine and Biology",538, ,0,0,0,0,0,0
2004,"Actomyosin energy turnover declines while force remains constant during isometric muscle contraction","West T.G., Curtin N.A., Ferenczi M.A., He Z.-H., Sun Y.-B., Irving M., Woledge R.C.",00223751,"Journal of Physiology",555, 1,8,1,1,2,1,11
2003,"Molecular and cellular aspects of muscle contraction. General discussion part III.","Woledge R.C., Curtin N.A., Rall J.A.",00652598,"Advances in experimental medicine and biology",538, ,0,0,0,0,0,0
2003,"Energy storage during stretch of active single fibres from frog skeletal muscle","Linari M., Woledge R.C., Curtin N.A.",00223751,"Journal of Physiology",548, 2,9,3,3,6,1,16
2002,"Excess recovery heat production by isolated muscles from mice overexpressing uncoupling protein-3","Curtin N.A., Clapham J.C., Barclay C.J.",00223751,"Journal of Physiology",542, 1,13,3,0,3,1,17
2002,"Fast muscle in squid (Loligo pealei): Contractile properties of a specialized muscle fibre type","Kier W.M., Curtin N.A.",00220949,"Journal of Experimental Biology",205, 13,7,1,3,4,2,13
2002,"Isometric and isovelocity contractile performance of red musle fibres from the dogfish Scyliorhinus canicula","Lou F., Curtin N.A., Woledge R.C.",00220949,"Journal of Experimental Biology",205, 11,9,0,4,4,1,14
2001,"The XXX European muscle conference","Curtin N.",01424319,"Journal of Muscle Research and Cell Motility",22, 7,0,0,0,0,0,0
2001,"Mechanical properties of red and white swimming muscles as a function of the position along the body of the eel Anguilla anguilla","D'Aout K., Curtin N.A., Williams T.L., Aerts P.",00220949,"Journal of Experimental Biology",204, 13,8,0,2,2,0,10
2001,"Synchronous oscillations of length and stiffness during loaded shortening of frog muscle fibres","Edman K.A.P., Curtin N.A.",00223751,"Journal of Physiology",534, 2,8,2,1,3,0,11
2000,"Heat production and oxygen consumption during metabolic recovery of white muscle fibres from the dogfish Scyliorhinus canicula","Lou F., Van Der Laarse W.J., Curtin N.A., Woledge R.C.",00220949,"Journal of Experimental Biology",203, 7,6,0,0,0,0,6
2000,"Energy storage by passive elastic structures in the mantle of Sepia officinalis","Curtin N.A., Woledge R.C., Bone Q.",00220949,"Journal of Experimental Biology",203, 5,4,0,1,1,0,5
1999,"Elastic energy storage and release in white muscle from dogfish Scyliorhinus canicula","Lou F., Curtin N.A., Woledge R.C.",00220949,"Journal of Experimental Biology",202, 2,9,2,1,3,0,12
1998,"Shortening during stimulation vs. during relaxation: How do the costs compare?","Lou F., Curtin N.A., Woledge R.C.",00652598,"Advances in Experimental Medicine and Biology",453, ,2,0,0,0,0,2
1998,"Contraction with shortening during stimulation or during relaxation: How do the energetic costs compare?","Lou F., Curtin N.A., Woledge R.C.",01424319,"Journal of Muscle Research and Cell Motility",19, 7,1,1,1,2,1,4
1998,"Distinguishing metabolic heat from condensation heat during muscle recovery","Lou F., Curtin N.A., Woledge R.C.",00220949,"Journal of Experimental Biology",201, 17,1,0,0,0,1,2
1998,"Predicting force generation by lamprey muscle during applied sinusoidal movement using a simple dynamic model","Williams T.L., Bowtell G., Curtin N.A.",00220949,"Journal of Experimental Biology",201, 6,8,1,1,2,0,10
1998,"Predictions of the time course of force and power output by dogfish white muscle fibres during brief tetani","Curtin N.A., Gardner-Medwin A.R., Woledge R.C.",00220949,"Journal of Experimental Biology",201, 1,18,4,3,7,1,26
1997,"First catch the fish: efficiency during stretchshortening cycles that mimic natural locomotion","Curtin N.A.",10658483,"Journal of Applied Biomechanics",13, 4,1,1,0,1,0,2
1997,"Contractile properties of obliquely striated muscle from the mantle of squid (Alloteuthis subulata) and cuttlefish (Sepia officinalis)","Milligan B.J., Curtin N.A., Bone Q.",00220949,"Journal of Experimental Biology",200, 18,13,1,3,4,1,18
1997,"Recovery after contraction of white muscle fibres from the dogfish Scyliorhinus canicula","Curtin N.A., Kushmerick M.J., Wiseman R.W., Woledge R.C.",00220949,"Journal of Experimental Biology",200, 7,10,2,3,5,2,17
1997,"The energetic cost of activation of white muscle fibres from the dogfish Scyliorhinus canicula","Lou F., Curtin N.A., Woledge R.C.",00220949,"Journal of Experimental Biology",200, 3,17,1,1,2,0,19
1996,"Power at the expense of efficiency in contraction of white muscle fibres from dogfish Scyliorhinus canicula","Curtin N.A., Woledge R.C.",00220949,"Journal of Experimental Biology",199, 3,21,2,2,4,1,26
1995,"Interactions between muscle activation, body curvature and the water in the swimming lamprey.","Williams T.L., Bowtell G., Carling J.C., Sigvardt K.A., Curtin N.A.",00811386,"Symposia of the Society for Experimental Biology",49, ,11,0,1,1,0,12
1995,"Effects of ?-cyano-4-hydroxycinnamic acid on fatigue and recovery of isolated mouse muscle","Clarke P.D., Clift D.L., Dooldeniya M., Burnett C.A.M., Curtin N.A.",01424319,"Journal of Muscle Research and Cell Motility",16, 6,1,0,0,0,0,1
1994,"Force-velocity relation for frog muscle fibres: Effects of moderate fatigue and of intracellular acidification","Curtin N.A., Edman K.A.P.",00223751,"Journal of Physiology",475, 3,35,1,2,3,0,38
1993,"Efficiency of energy conversion during sinusoidal movement of red muscle fibres from the dogfish Scyliorhinus canicula","Curtin N.A., Woledge R.C.",00220949,"Journal of Experimental Biology",185, ,28,3,1,4,1,33
1993,"Synchronous length oscillations during loaded shortening of isolated muscle fibres from frog","Edman K.A.P., Curtin N.A.",00223751,"Journal of Physiology",473, ,1,0,0,0,0,1
1993,"Role of parvalbumin in relaxation of frog skeletal muscle","Hou T.-T., Maughan D., Ter Keurs H.E.D.J., Yamada T., Homsher E., Johnson J.D., Rall J.A., Pollack G.H., Curtin N.A., Kushmerick M.J., Ashley C.C., Edman K.A.P., Gillis J.M.",00652598,"Advances in Experimental Medicine and Biology",332, ,8,0,0,0,0,8
1993,"Changes in crossbridge and non-crossbridge energetics during moderate fatigue of frog muscle fibres","Barclay C.J., Curtin N.A., Woledge R.C.",00223751,"Journal of Physiology",468, ,12,2,1,3,1,16
1993,"The efficiency of energy conversion by swimming muscles of fish","Woledge R.C., Pollack G.H., Ter Keurs H.E.D.J., Homsher E., Curtin N.A., Suga H., Gergely J., Brenner B., Huxley, Goldman Y.E., Kushmerick M.J., Morales M.F.",00652598,"Advances in Experimental Medicine and Biology",332, ,1,1,0,1,0,2
1993,"Power and efficiency: How to get the most out of striated muscle","Curtin N.A., Woledge R.C., Suga H., Huxley",00652598,"Advances in Experimental Medicine and Biology",332, ,2,1,0,1,1,4
1991,"Efficiency of energy conversion during shortening of muscle fibres from the dogfish Scyliorhinus canicula.","Curtin N.A., Woledge R.C.",00220949,"Journal of Experimental Biology",158, ,15,0,0,0,0,15
1990,"The price of being a snake","Woledge R.C., Curtin N.A.",00280836,"Nature",347, 6294,2,0,0,0,0,2
1990,"Force during stretch and shortening of frog sartorius muscle: Effects of intracellular acidification due to increased carbon dioxide","Curtin N.A.",01424319,"Journal of Muscle Research and Cell Motility",11, 3,3,0,0,0,0,3
1990,"Implications of the septal structure in fish muscle","Gardner-Medwin A.R., Curtin N.A.",00223751,"Journal of Physiology",426, ,0,0,0,0,0,0
1990,"Force during shortening and stretch of active muscle fibres isolated from the lamprey, Ichthyomyzon unicuspis","Curtin N.A., Williams T.L.",00223751,"Journal of Physiology",430, ,0,0,0,0,0,0
1990,"Stimulus pattern for sustained work output during cyclic contractions of white muscle isolated from dogfish","Curtin N.A., Woledge R.C.",00223751,"Journal of Physiology",426, ,0,0,0,0,0,0
1989,"Fatigue of isolated mouse muscle due to isometric tetani and tetani with high power output","Cummins M.E., Soomal R.S., Curtin N.A.",01448757,"Quarterly Journal of Experimental Physiology",74, 6,3,0,3,3,2,8
1989,"Energetics and mechanics of contracting white myotomal fibres from dogfish, Scyliorhinus canicula.","Curtin N.A., Woledge R.C.",03617742,"Progress in clinical and biological research",315, ,0,0,0,0,0,0
1989,"Effects of fatigue and reduced intracellular pH on segment dynamics in 'isometric' relaxation of frog muscle fibres","Curtin N.A., Edman K.A.P.",00223751,"Journal of Physiology",413, ,14,2,0,2,1,17
1988,"The mdx mouse skeletal muscle myopathy: II. Contractile properties","Coulton G.R., Curtin N.A., Morgan J.E., Partridge T.A.",03051846,"Neuropathology and Applied Neurobiology",14, 4,35,3,4,7,3,45
1988,"Effect of intracellular pH on force and heat production in isometric contraction of frog muscle fibres","Curtin N.A., Kometani K., Woledge R.C.",00223751,"Journal of Physiology",396, ,5,0,0,0,0,5
1988,"Intracellular pH and relaxation of frog muscle.","Curtin N.A.",00652598,"Advances in Experimental Medicine and Biology",226, ,0,0,0,0,1,1
1987,"Intracellular pH and buffer power of type 1 and 2 fibres from skeletal muscle of Xenopus laevis","Curtin N.A.",00316768,"Pflugers Archiv European Journal of Physiology",408, 4,2,0,0,0,0,2
1986,"Buffer power and intracellular pH of frog sartorius muscle","Curtin N.A.",00063495,"Biophysical Journal",50, 5,6,0,0,0,0,6
1986,"Absolute values of myothermic measurements on single muscle fibres from frog","Curtin N.A., Howarth J.V., Rall J.A., Wilson M.G.A., Woledge R.C.",01424319,"Journal of Muscle Research and Cell Motility",7, 4,2,0,0,0,0,2
1986,"Effects of carbon dioxide and tetanus duration on relaxation of frog skeletal muscle","Curtin N.A.",01424319,"Journal of Muscle Research and Cell Motility",7, 3,2,0,0,0,1,3
1985,"Energetic aspects of muscle contraction.","Woledge R.C., Curtin N.A., Homsher E.",00792020,"Monographs of the Physiological Society",41, ,66,2,4,6,1,73
1984,"Intramuscular pH and energy changes in muscle.","Curtin N.A.",00652598,"Advances in Experimental Medicine and Biology",170, ,0,0,0,0,0,0
1984,"Simultaneous heat and tension measurements from single muscle cells.","Curtin N.A., Howarth J.V., Rall J.A., Wilson M.G., Woledge R.C.",00652598,"Advances in Experimental Medicine and Biology",170, ,0,0,0,0,0,0
1983,"Heat production by single fibres of frog muscle","Curtin N.A., Howarth J.V., Woledge R.C.",01424319,"Journal of Muscle Research and Cell Motility",4, 2,1,0,0,0,1,2
1982,"Energy balance in frog skeletal muscle","Curtin N.A., Woledge R.C.",00149446,"Federation Proceedings",41, 2,0,0,0,0,0,0
1981,"Effect of muscle length on energy balance in frog skeletal muscle","Curtin N.A., Woledge R.C.",00223751,"Journal of Physiology",316, ,6,1,1,2,0,8
1979,"Chemical change, production of tension and energy following stretch of active muscle of frog","Curtin N.A., Woledge R.C.",00223751,"Journal of Physiology",297, ,2,1,0,1,0,3
1979,"Chemical change and energy production druing contraction of frog muscle: how are their time courses related?","Curtin N.A., Woledge R.C.",00223751,"Journal of Physiology",288, ,14,0,0,0,0,14
1978,"Energy changes and muscular contraction","Curtin N.A., Woledge R.C.",00319333,"Physiological Reviews",58, 3,24,1,2,3,0,27
1977,"A comparison of the energy balance in two successive isometric tetani of frog muscle","Curtin N.A., Woledge R.C.",00223751,"Journal of Physiology",270, 2,4,0,0,0,0,4
1976,"Proceedings: The prolongation of relaxation after an isometric tetanus.","Curtin N.A.",00223751,"Journal of Physiology",258, 2,0,0,0,0,0,0
1975,"Very high tension with very little ATP breakdown by active skeletal muscle","Curtin N.A., Davies R.E.",,"Journal of Mechanochemistry and Cell Motility",3, 2,14,4,1,5,0,19
1975,"Energy balance in DNFB treated and untreated frog muscle","Curtin N.A., Woledge R.C.",00223751,"Journal of Physiology",246, 3,1,0,0,0,0,1
1974,"Energetics of relaxation in frog muscle","Curtin N.A., Woledge R.C.",00223751,"Journal of Physiology",238, 2,0,0,0,0,0,0
1974,"The effect of the performance of work on total energy output and metabolism during muscular contraction","Curtin N.A., Gilbert C., Kretzschmar K.M., Wilkie D.R.",00223751,"Journal of Physiology",238, 3,14,0,1,1,0,15
