1992,"Fitting the Armitage-Doll model to radiation-exposed cohorts and implications for population cancer risks","Little M.P., Hawkins M.M., Charles M.W., Hildreth N.G.",00337587,"Radiation Research",132, 2,13,0,2,2,0,15
1992,"The risks of leukaemia and non-cancer mortality in the offspring of the Japanese bomb survivors and a comparison of leukaemia risks with those in the offspring of the Sellafield workforce","Little M.P.",09524746,"Journal of Radiological Protection",12, 4,5,0,0,0,0,5
1992,"Erratum: Time variations in the risk of cancer following irradiation in childhood (Radiation Research (1991) 126:3 (304-316))","Little M.P., Hawkins M.M., Shore R.E., Charles M.W., Hildreth N.G.",00337587,"Radiation Research",132, 1,0,0,0,0,0,0
1991,"A comparison of the apparent risks of childhood leukaemia from parental exposure to radiation in the six months prior to conception in the Sellafield workforce and the Japanese bomb survivors","Little M.P.",09524746,"Journal of Radiological Protection",11, 2,2,0,0,0,0,2
1991,"Time variations in radiation-induced relative risk and implications for population cancer risks","Little M.P., Charles M.W.",09524746,"Journal of Radiological Protection",11, 2,9,0,0,0,0,9
1991,"A comparison of the risks of childhood leukaemia from parental pre-conception exposure to radiation in the Sellafield and Dounreay workforces and the Japanese bomb survivors","Little M.P.",09524746,"Journal of Radiological Protection",11, 4,0,0,0,0,0,0
1991,"Selection effects in the Japanese bomb survivors [2]","Little M.P., Charles M.W., Stewart A.M.",00207616,"International Journal of Radiation Biology",59, 6,0,0,0,0,0,0
1991,"Time variations in the risk of cancer following irradiation in childhood","Little M.P., Hawkins M.M., Shore R.E., Charles M.W., Hildreth N.G.",00337587,"Radiation Research",126, 3,24,1,0,1,0,25
1991,"Absence of risk associated with exposure to radiation before conception in Japan [18]","Little M.P., Charles M.W.",09598146,"British Medical Journal",302, 6789,0,0,0,0,0,0
1990,"A comparison between the risks of childhood leukaemia from parental exposure to radiation in the Sellafield workforce and those displayed among the Japanese bomb survivors","Little M.P.",09524746,"Journal of Radiological Protection",10, 3,5,1,0,1,0,6
1990,"Bomb survivor selection and consequences for estimates of population cancer risks","Little M.P., Charles M.W.",00179078,"Health Physics",59, 6,7,1,0,1,0,8
1989,"Estimation of population cancer risks from the DS86 bomb survivor data","Little M.P., Charles M.W.",09524746,"Journal of Radiological Protection",9, 1,0,0,0,0,0,0
