1992,"Recurrent early pregnancy failure","Regan L.",1040872X,"Current Opinion in Obstetrics and Gynecology",4, 2,9,0,1,1,0,10
1991,"A prospective study of the incidence, time of appearance and significance of anti-paternal lymphocytotoxic antibodies in human pregnancy","Regan L., Braude P.R., Hill D.P.",02681161,"Human Reproduction",6, 2,22,1,2,3,0,25
1991,"Recurrent miscarriage","Regan L.",09598146,"British Medical Journal",302, 6776,18,0,0,0,0,18
1990,"Hypersecretion of luteinising hormone, infertility, and miscarriage","Regan L., Owen E.J., Jacobs H.S.",01406736,"Lancet",336, 8724,204,8,10,18,5,227
1989,"Influence of past reproductive performance on risk of spontaneous abortion","Regan L., Braude P.R., Trembath P.L.",02670623,"British Medical Journal",299, 6698,93,10,11,21,6,120
1987,"Is antipaternal cytotoxic antibody a valid marker in the management of recurrent abortion?","Regan L., Braude P.R.",01406736,"Lancet",2, 8570,6,1,0,1,0,7
