1975,"Penicillin binding protein in Escherichia coli","Spratt B.G., Pardee A.B.",00149446,"Federation Proceedings",34, 3,0,0,0,0,0,0
1975,"Penicillin binding proteins and cell shape in E. coli","Spratt B.G., Pardee A.B.",00280836,"Nature",254, 5500,56,1,8,9,4,69
1973,"Two major groups of colicin factors: their evolutionary significance","Hardy K.G., Meynell G.G., Dowman J.E., Spratt B.G.",00268925,"Molecular and General Genetics",125, 3,0,1,0,1,0,1
1973,"The plasmid of Salmonella typhimurium LT2","Spratt B.G., Rowbury R.J., Meynell G.G.",00268925,"MGG Molecular & General Genetics",121, 4,5,0,0,0,0,5
1972,"Replication of extrachromosomal elements in a DNA synthesis initiation mutant of Salmonella typhimurium","Spratt B.G.",0006291X,"Biochemical and Biophysical Research Communications",48, 3,0,0,0,0,0,0
1972,"Cell division and the production of cells lacking nuclear bodies in a mutant of Salmonella typhimurium","Shannon K.P., Spratt B.G., Rowbury R.J.",00268925,"MGG Molecular & General Genetics",118, 2,1,0,0,0,0,1
1972,"Physiological and genetical studies on a mutant of Salmonella typhimurium which is temperature-sensitive for DNA synthesis","Spratt B.G., Rowbury R.J.",00268925,"MGG Molecular & General Genetics",114, 1,0,0,0,0,0,0
1971,"Cell division in a mutant of Salmonella typhimurium which is temperature-sensitive for DNA synthesis.","Spratt B.G., Rowbury R.J.",00221287,"Journal of General Microbiology",65, 3,0,0,0,0,0,0
1970,"A mutant in the initiation of DNA synthesis in Salmonella typhimurium.","Spratt B.G., Rowbury R.J.",00221287,"Journal of General Microbiology",64, 2,0,0,0,0,0,0
1970,"Production of DNA-less cells in a mutant of Salmonella typhimurium.","Spratt B.G., Rowbury R.J.",00221287,"Journal of General Microbiology",63, 3,0,0,0,0,0,0
1970,"A mutant in the initiation of DNA synthesis in Salmonella typhimurium.","Spratt B.G., Rowbury R.J.",00221287,"Journal of General Microbiology",63, 3,0,0,0,0,0,0
