,"This is a citation overview for a set of 38 documents.",,,,,,,,,,,
,,,,,,,,,,,,
,"h index = 16 (Of the 38 documents considered for the h-Index, 16 have been cited at least 16 times.)",,,,,,,,,,,
,Note: Scopus does not have complete citation information for articles published before 1996.  ,,,,,,,,,,,
,,,,,,,,,,,,
,,,,,,,<2007,2007,2008,subtotal,>2008,total
Publication Year,Document Title,Authors,ISSN,Journal Title,Volume,Issue,678,238,253,491,181,1350
2009,"A rare variant in the visfatin gene (nampt/pbef1) is associated with protection from obesity","Blakemore A.I.F., Walley A.J., Meyre D., Delplanque J., Vatin V., Lecoeur C., Marre M., Tichet J., Balkau B., Froguel P.",19307381,"Obesity",17, 8,0,0,0,0,0,0
2009,"The role of ghrelin and ghrelin-receptor gene variants and promoter activity in type 2 diabetes.","Garcia E.A., Grossman A.B., Kojima M., Petersenn S., Froguel P., Korbonits M., King P., Sidhu K., Ohgusu H., Walley A., Lecoeur C., Gueorguiev M., Khalaf S., Davies D.",1479683X,"European journal of endocrinology / European Federation of Endocrine Societies",161, 2,0,0,0,0,0,0
2009,"The genetic contribution to non-syndromic human obesity","Walley A.J., Asher J.E., Froguel P.",14710056,"Nature Reviews Genetics",10, 7,0,0,0,0,0,0
2009,"Regulation of carboxylesterase 1 (CES1) in human adipose tissue","Jernas M., Carlsson L.M.S., Olsson B., Arner P., Jacobson P., Sjostrom L., Walley A., Froguel P., McTernan P.G., Hoffstedt J.",0006291X,"Biochemical and Biophysical Research Communications",383, 1,0,0,0,0,0,0
2009,"ALK7 expression is specific for adipose tissue, reduced in obesity and correlates to factors implicated in metabolic disease","Carlsson L.M.S., Jacobson P., Walley A., Froguel P., Sjostrom L., Svensson P.-A., Sjoholm K.",0006291X,"Biochemical and Biophysical Research Communications",382, 2,0,0,0,0,0,0
2009,"Genome-wide association study for early-onset and morbid adult obesity identifies three new risk loci in European populations","Meyre D., Proenca C., Gaget S., Korner A., Kovacs P., Kiess W., Tichet J., Marre M., Hartikainen A.-L., Horber F., Potoczna N., Delplanque J., Hercberg S., Levy-Marchal C., Pattou F., Heude B., Tauber M., McCarthy M.I., Blakemore A.I.F., Montpetit A., Polychronakos C., Weill J., Chevre J.-C., Coin L.J.M., Asher J., Elliott P., Jarvelin M.-R., Visvikis-Siest S., Balkau B., Sladek R., Balding D., Walley A., Dina C., Lecoeur C., Froguel P., Lobbens S., Gallina S., Durand E., Vatin V., Degraeve F.",10614036,"Nature Genetics",41, 2,0,0,0,0,15,15
2009,"A variant near MTNR1B is associated with increased fasting plasma glucose levels and type 2 diabetes risk","Bouatia-Naji N., Durand E., De Graeve F., Chevre J.-C., Borch-Johnsen K., Hartikainen A.-L., Ruokonen A., Tichet J., Marre M., Weill J., Heude B., Bonnefond A., Tauber M., Lemaire K., Schuit F., Elliott P., Jorgensen T., Charpentier G., Hadjadj S., Cauchi S., Vaxillaire M., Sladek R., Cavalcanti-Proenca C., Visvikis-Siest S., Balkau B., Levy-Marchal C., Pattou F., Meyre D., Blakemore A.I.F., Jarvelin M.-R., Walley A.J., Hansen T., Dina C., Sparso T., Pedersen O., Froguel P., Holmkvist J., Marchand M., Delplanque J., Lobbens S., Rocheleau G.",10614036,"Nature Genetics",41, 1,0,0,0,0,16,16
2008,"Common nonsynonymous variants in PCSK1 confer risk of obesity","Benzinou M., Heude B., Balkau B., Tichet J., Marre M., Potoczna N., Horber F., Le Stunff C., Czernichow S., Sandbaek A., Lauritzen T., Creemers J.W.M., Borch-Johnsen K., Andersen G., Kiess W., Korner A., Kovacs P., Jacobson P., Carlsson L.M.S., Walley A.J., Hansen T., Choquet H., Pedersen O., Meyre D., Froguel P., Lobbens S., Dina C., Durand E., Guerardel A., Boutin P., Jouret B.",10614036,"Nature Genetics",40, 8,0,0,2,2,12,14
2007,"I?B genetic polymorphisms and invasive pneumococcal disease","Chapman S.J., Gillespie S.H., Denny P., Day N.P., Crook D.W., Davies R.J.O., Hill A.V.S., Khor C.C., Vannberg F.O., Frodsham A., Walley A., Maskell N.A., Davies C.W.H., Segal S., Moore C.E.",1073449X,"American Journal of Respiratory and Critical Care Medicine",176, 2,0,0,2,2,3,5
2007,"A Mal functional variant is associated with protection against invasive pneumococcal disease, bacteremia, malaria and tuberculosis","Khor C.C., Khan A., Aucan C., Segal S., Moore C.E., Knox K., Campbell S.J., Lienhardt C., Scott A., Aaby P., Sow O.Y., Chapman S.J., Grignani R.T., Sillah J., Sirugo G., Peshu N., Williams T.N., Maitland K., Davies R.J.O., Kwiatkowski D.P., Day N.P., Yala D., Vannberg F.O., Crook D.W., Marsh K., Berkley J.A., O'Neill L.A.J., Hill A.V.S., Dunne A., Murphy C., Ling E.Y., Frodsham A.J., Walley A.J., Kyrieleis O.",10614036,"Nature Genetics",39, 4,0,19,40,59,24,83
2007,"Leptin receptor genotype at Gln223Arg is associated with body composition, BMD, and vertebral fracture in postmenopausal Danish women","Fairbrother U.L., Tanko L.B., Walley A.J., Christiansen C., Froguel P., Blakemore A.I.F.",08840431,"Journal of Bone and Mineral Research",22, 4,0,0,6,6,7,13
2007,"Single nucleotide polymorphisms in the neuropeptide Y2 receptor (NPY2R) gene and association with severe obesity in French white subjects","Siddiq A., Walley A., Froguel P., Gueorguiev M., Samson C., Hercberg S., Heude B., Levy-Marchal C., Jouret B., Weill J., Meyre D.",0012186X,"Diabetologia",50, 3,0,1,1,2,2,4
2007,"No contribution of angiotensin-converting enzyme (ACE) gene variants to severe obesity: A model for comprehensive case/control and quantitative cladistic analysis of ACE in human diseases","Bell C.G., Mein C.A., Aitman T.J., Froguel P., Walley A.J., Meyre D., Petretto E., Levy-Marchal C., Hercberg S., Charles M.A., Boyle C., Weill J., Tauber M.",10184813,"European Journal of Human Genetics",15, 3,0,0,1,1,0,1
2006,"Genetics of obesity and the prediction of risk for health","Walley A.J., Blakemore A.I.F., Froguel P.",09646906,"Human Molecular Genetics",15, 2,0,6,13,19,5,24
2006,"Bardet-Biedl syndrome gene variants are associated with both childhood and adult common obesity in French Caucasians","Benzinou M., Walley A., Lobbens S., Charles M.-A., Jouret B., Fumeron F., Balkau B., Meyre D., Froguel P.",00121797,"Diabetes",55, 10,1,5,4,9,4,14
2006,"Erratum: ACDC/adiponectin and PPAR-? gene polymorphisms: Implications for features of obesity (obesity (2005) 13:12 (2113-2121))","Tanko L.B., Siddiq A., Lecoeur C., Larsen P.J., Christiansen C., Walley A., Froguel P.",19307381,"Obesity",14, 5,0,0,0,0,0,0
2005,"ACDC/adiponectin and PPAR-? gene polymorphisms: Implications for features of obesity","Tanko L.B., Siddiq A., Lecoeur C., Larsen P.J., Christiansen C., Walley A., Froguel P.",10717323,"Obesity Research",13, 12,4,5,4,9,5,18
2005,"Association of melanin-concentrating hormone receptor 1 5? polymorphism with early-onset extreme obesity","Bell C.G., Charles M.A., Weill J., Gibson F., Mein C.A., Froguel P., Walley A.J., Meyre D., Samson C., Boyle C., Lecoeur C., Tauber M., Jouret B., Jaquet D., Levy-Marchal C.",00121797,"Diabetes",54, 10,3,8,3,11,2,16
2005,"Variants of ENPP1 are associated with childhood and adult obesity and increase the risk of glucose intolerance and type 2 diabetes","Meyre D., Charpentier G., Patsch W., Pattou F., Charles M.-A., Tounian P., Clement K., Jouret B., Weill J., Maddux B.A., Goldfine I.D., Bouatia-Naji N., Walley A., Boutin P., Dina C., Froguel P., Tounian A., Samson C., Lecoeur C., Vatin V., Ghoussaini M., Wachter C., Hercberg S.",10614036,"Nature Genetics",37, 8,33,33,42,75,15,123
2005,"The genetics of human obesity","Bell C.G., Walley A.J., Froguel P.",14710056,"Nature Reviews Genetics",6, 3,44,38,42,80,19,143
2004,"Erratum: Common apolipoprotein E polymorphisms and risk of clinical malaria in The Gambia (Journal of Medical Genetics (2004) 41 (21-24))","Aucan C., Walley A.J., Hill A.V.S.",00222593,"Journal of Medical Genetics",41, 3,0,0,0,0,0,0
2004,"Interleukin-1 gene cluster polymorphins and susceptibility to clinical malaria in a Gambian case-control study","Walley A.J., Aucan C., Kwiatkowski D., Hill A.V.S.",10184813,"European Journal of Human Genetics",12, 2,9,4,5,9,2,20
2004,"Common apolipoprotein E polymorphisms and risk of clinical malaria in the Gambia","Aucan C., Walley A.J., Hill A.V.S.",00222593,"Journal of Medical Genetics",41, 1,2,0,3,3,0,5
2003,"Association of Fc? receptor IIa (CD32) polymorphism with severe malaria in West Africa","Cooke G.S., Aucan C., Walley A.J., Segal S., Greenwood B.M., Kwiatkowski D.P., Hill A.V.S.",00029637,"American Journal of Tropical Medicine and Hygiene",69, 6,9,7,5,12,6,27
2003,"Interferon-alpha receptor-1 (IFNAR1) variants are associated with protection against cerebral malaria in The Gambia","Aucan C., Walley A.J., Hennig B.J.W., Fitness J., Frodsham A., Zhang L., Kwiatkowski D., Hill A.V.S.",14664879,"Genes and Immunity",4, 4,10,7,4,11,0,21
2003,"Haptoglobin genotypes are not associated with resistance to severe malaria in The Gambia (multiple letters) [1]","Quaye I., Aucan C., Walley A.J., Hill A.V.S.",00359203,"Transactions of the Royal Society of Tropical Medicine and Hygiene",97, 1,0,1,1,2,0,2
2002,"Haptoglobin genotypes are not associated with resistance to severe malaria in The Gambia","Aucan C., Walley A.J., Greenwood B.M., Hill A.V.S.",00359203,"Transactions of the Royal Society of Tropical Medicine and Hygiene",96, 3,9,5,3,8,1,18
2001,"Gene polymorphism in Netherton and common atopic disease","Walley A.J., Harper J.I., Hovnanian A., Cookson W.O.C.M., Chavanas S., Moffatt M.F., Esnouf R.M., Ubhi B., Lawrence R., Wong K., Abecasis G.R., Jones E.Y.",10614036,"Nature Genetics",29, 2,80,22,27,49,17,146
2001,"Genetic linkage of childhood atopic dermatitis to psoriasis susceptibility loci","Cookson W.O.C.M., Moffatt M.F., Harper J.I., Ubhi B., Lawrence R., Abecasis G.R., Walley A.J., Cox H.E., Coleman R., Leaves N.I., Trembath R.C.",10614036,"Nature Genetics",27, 4,128,44,24,68,16,212
2001,"Linkage and allelic association of chromosome 5 cytokine cluster genetic markers with atopy and asthma associated traits","Walley A.J., Wiltshire S., Ellis C.M., Cookson W.O.C.M.",08887543,"Genomics",72, 1,30,5,2,7,5,42
2000,"Delta 32 deletion of CCR5 gene and association with asthma or atopy","Mitchell T.J., Walley A.J., Pease J.E., Venables P.J.W., Wiltshire S., Williams T.J., Cookson W.O.C.M.",01406736,"Lancet",356, 9240,26,0,2,2,1,29
1999,"Indication of linkage of serum IgE levels to the interleukin-4 gene and exclusion of the contribution of the (-590 C to T) interleukin-4 promoter polymorphism to IgE variation","Dizier M.-H., Sandford A., Walley A., Philippi A., Cookson W., Demenais F.",07410395,"Genetic Epidemiology",16, 1,25,1,1,2,0,27
1998,"Association of atopic dermatitis to the beta subunit of the high affinity immunoglobulin E receptor","Cox H.E., Moffatt M.F., Faux J.A., Walley A.J., Coleman R., Trembath R.C., Cookson W.O.C.M., Harper J.I.",00070963,"British Journal of Dermatology",138, 1,104,13,3,16,2,122
1996,"Investigation of an interleukin-4 promoter polymorphism for associations with asthma and atopy","Walley A.J., Cookson W.O.C.M.",00222593,"Journal of Medical Genetics",33, 8,133,13,8,21,2,156
1995,"Three unrelated Gaucher's disease patients with three novel point mutations in the glucocerebrosidase gene (P266R, D315H and A318D)","Walley A.J., Ellis I., Harris A.",00071048,"British Journal of Haematology",91, 2,6,0,2,2,0,8
1993,"A novel point mutation (D380A) and a rare deletion (1255del55) in the glucocerebrosidase gene causing Gaucher's disease","Walley A.J., Harris A.",09646906,"Human Molecular Genetics",2, 10,10,0,2,2,0,12
1993,"Gaucher's disease in the United Kingdom: Screening non-Jewish patients for the two common mutations","Walley A.J., Barth M.L., Ellis I., Fensom A.H., Harris A.",00222593,"Journal of Medical Genetics",30, 4,12,1,1,2,0,14
1989,"Direct RNA binding by the rev product of HIV-1","Walley A.J., Heaphy S., Jones I.M.",02699370,"AIDS",3, 12,0,0,0,0,0,0
