,This is a citation overview for a set of 546 documents.,,,,,,,,,,,
,,,,,,,,,,,,
,"h index = 47 (Of the 546 documents considered for the h-Index, 47 have been cited at least 47 times.)",,,,,,,,,,,
,Note: Scopus does not have complete citation information for articles published before 1996.  ,,,,,,,,,,,
,,,,,,,,,,,,
,,,,,,,<2007,2007,2008,subtotal,>2008,total
Publication Year,Document Title,Authors,ISSN,Journal Title,Volume,Issue,7713,930,763,1693,623,10029
2009,Diagnosis and therapy of male hormonal changes related to aging | Miehen ik‰‰ntymiseen liittyvien hormonimuutosten diagnostiikka ja hoito.,"Huhtaniemi I., Perheentupa A.",127183,Duodecim; l‰‰ketieteellinen aikakauskirja,125,10,0,0,0,0,0,0
2009,PDK1 signaling in oocytes controls reproductive aging and lifespan by manipulating the survival of primordial follicles,"Reddy P., Huhtaniemi I., Liu K., Adhikari D., Zheng W., Liang S., Hamalainen T., Tohonen V., Ogawa W., Noda T., Volarevic S.",9646906,Human Molecular Genetics,18,15,0,0,0,0,1,1
2009,Role of androgen and gonadotrophins in the development and function of the Sertoli cells and Leydig cells: Data from mutant and genetically modified mice,"O'Shaughnessy P.J., Morris I.D., Huhtaniemi I., Baker P.J., Abel M.H.",3037207,Molecular and Cellular Endocrinology,306, 1-2,0,0,0,0,0,0
2009,15th European Workshop on Molecular and Cellular Endocrinology of the Testis. Introduction.,Huhtaniemi I.,18728057,Molecular and cellular endocrinology,306, 1-2,0,0,0,0,0,0
2009,Introduction,Huhtaniemi I.,3037207,Molecular and Cellular Endocrinology,306, 1-2,0,0,0,0,0,0
2009,"Mechanisms of protein kinase C signaling in the modulation of 3?,5?-cyclic adenosine monophosphate-mediated steroidogenesis in mouse gonadal cells","Manna P.R., Huhtaniemi I.T., Stocco D.M.",137227,Endocrinology,150,7,0,0,0,0,0,0
2009,Association between 25-hydroxyvitamin D levels and cognitive performance in middle-aged and older European men,"Lee D.M., Tajar A., Ulubaev A., Pendleton N., O'Neill T.W., O'Connor D.B., Bartfai G., Boonen S., Bouillon R., Casanueva F.F., Finn J.D., Forti G., Giwercman A., Han T.S., Huhtaniemi I.T., Kula K., Lean M.E., Punab M., Silman A.J., Vanderschueren D., Wu F.C.",223050,"Journal of Neurology, Neurosurgery and Psychiatry",80,7,0,0,0,0,0,0
2009,Estrogen enhances recovery from radiation-induced spermatogonial arrest in rat testes,"Porter K.L., Shetty G., Shuttlesworth G.A., Weng C.C.Y., Huhtaniemi I., Pakarinen P., Meistrich M.L.",1963635,Journal of Andrology,30,4,0,0,0,0,0,0
2009,Hecate-CG? conjugate and gonadotropin suppression shows two distinct mechanisms of action in the treatment of adrenocortical tumors in transgenic mice expressing Simian Virus 40 T antigen under inhibin-? promoter,"Vuorenoja S., Mohanty B.P., Arola J., Huhtaniemi I., Toppari J., Rahman N.A.",13510088,Endocrine-Related Cancer,16,2,0,0,0,0,0,0
2009,Investigating the determinants of international differences in the prevalence of chronic widespread pain: Evidence from the European Male Ageing Study,"Macfarlane G.J., Pye S.R., Finn J.D., Wu F.C., Silman A.J., Bartfai G., Boonen S., Casanueva F., Forti G., Giwercman A., Han T.S., Huhtaniemi I.T., Kula K., Lean M.E., O'Neill T.W., Pendleton N., Punab M., Vanderschueren D.",34967,Annals of the Rheumatic Diseases,68,5,0,0,0,0,0,0
2009,Adrenal hyperplasia and tumours in mice in connection with aberrant pituitary-gonadal function,"Bernichtein S., Peltoketo H., Huhtaniemi I.",3037207,Molecular and Cellular Endocrinology,300, 1-2,0,0,0,0,0,0
2009,Aging of the human ovary and testis,"Perheentupa A., Huhtaniemi I.",3037207,Molecular and Cellular Endocrinology,299,1,0,0,0,0,0,0
2009,Genetic variation in sex hormone genes influences heel ultrasound parameters in middle-aged and elderly men: Results from the European Male Aging Study (EMAS),"Limer K.L., Pye S.R., Thomson W., Boonen S., Borghs H., Vanderschueren D., Huhtaniemi I.T., Adams J.E., Ward K.A., Platt H., Payne D., John S.L., Bartfai G., Casanueva F., Finn J.D., Forti G., Giwercman A., Han T.S., Kula K., Lean M.E., Pendleton N., Punab M., Silman A.J., Wu F.C., O'Neill T.W.",8840431,Journal of Bone and Mineral Research,24,2,0,0,0,0,0,0
2009,"The european male ageing study (EMAS): Design, methods and recruitment","Lee D.M., Forti G., Giwercman A., Huhtaniemi I.T., Kula K., Punab M., Boonen S., Vanderschueren D., Wu F.C.W., O'neill T.W., Pye S.R., Silman A.J., Finn J.D., Pendleton N., Tajar A., Bartfai G., Casanueva F.",1056263,International Journal of Andrology,32,1,0,0,0,0,1,1
2009,Increased plasma membrane expression of human follicle-stimulating hormone receptor by a small molecule thienopyr(im)idine,"Janovick J.A., Maya-Nunez G., Ulloa-Aguirre A., Huhtaniemi I.T., Dias J.A., Verbost P., Conn P.M.",3037207,Molecular and Cellular Endocrinology,298, 1-2,0,0,0,0,2,2
2009,Will GnRH antagonists improve prostate cancer treatment?,"Huhtaniemi I., White R., McArdle C.A., Persson B.-E.",10432760,Trends in Endocrinology and Metabolism,20,1,0,0,0,0,3,3
2009,Increased estrogen rather than decreased androgen action is associated with longer androgen receptor CAG repeats,"Huhtaniemi I.T., Boonen S., Borghs H., Vanderschueren D., Adams J.E., Ward K.A., Bartfai G., Casanueva F., Finn J.D., Forti G., Giwercman A., Pye S.R., Han T.S., Kula K., Lean M.E.J., Pendleton N., Punab M., Silman A.J., Wu F.C.W., Petrone L., Cilotti A., Slowikowska-Hilczer J., Limer K.L., Walczak-Jedrzejowska R., Wu F., Steer P., Tajar A., Lee D., Thomson W., Ocampo M., Lage M., Foldesi I., Fejes I., Korrovitz P., O'Neill T.W., Platt H., Payne D., John S.L., Jiang M.",0021972X,Journal of Clinical Endocrinology and Metabolism,94,1,0,0,0,0,2,2
2008,Smoking and low serum testosterone associates with high concentration of oxidized LDL,"Linna M.S., Ahotupa M., Irjala K., Pollanen P., Huhtaniemi I., Makinen J., Perheentupa A., Vasankari T.J.",7853890,Annals of Medicine,40,8,0,0,0,0,1,1
2008,GATA-4 regulates Bcl-2 expression in ovarian granulosa cell tumors,"Kyronlahti A., Heikinheimo M., Anttonen M., Ramo M., Tamminen M., Unkila-Kallio L., Butzow R., Leminen A., Nemer M., Rahman N., Huhtaniemi I.",137227,Endocrinology,149,11,0,0,0,0,2,2
2008,Is the adrenal cortex a target for gonadotropins?,"Bernichtein S., Alevizaki M., Huhtaniemi I.",10432760,Trends in Endocrinology and Metabolism,19,7,0,0,0,0,1,1
2008,Serum testosterone but not leptin predicts mortality in elderly men,"Lehtonen A., Huupponen R., Tuomilehto J., Lavonius S., Arve S., Isoaho H., Huhtaniemi I., Tilvis R.",20729,Age and Ageing,37,4,0,0,1,1,1,2
2008,"Male hormonal contraception: A double-blind, placebo-controlled study","Mommers E., Gerbershagen H.-P., Gronlund L., Heger-Mahn D., Huhtaniemi I., Koldewijn E.L., Lange C., Lindenberg S., Meriggiola M.C., Meuleman E., Mulders P.F.A., Kersemaekers W.M., Nieschlag E., Perheentupa A., Solomon A., Vaisala L., Wu F.C., Zitzmann M., Elliesen J., Kepers M., Apter D., Behre H.M., Beynon J., Bouloux P.M., Costantino A.",0021972X,Journal of Clinical Endocrinology and Metabolism,93,7,0,0,1,1,4,5
2008,Hypothalamic-pituitary-testicular axis disruptions in older men are differentially linked to age and modifiable risk factors: The European male aging study,"Wu F.C.W., Giwercman A., Huhtaniemi I.T., Kula K., Punab M., Boonen S., Vanderschueren D., Petrone L., Cilotti A., Borghs H., Slowikowska-Hilczer J., Tajar A., Walczak-Jedrzejowska R., Steer P., Lee D., Ocampo M., Lage M., Pye S.R., Bartfai G., Foldesi I., Fejes I., Korrovitz P., Jiang M., Silman A.J., Finn J.D., O'Neill T.W., Bartfai G., Casanueva F., Forti G.",0021972X,Journal of Clinical Endocrinology and Metabolism,93,7,0,0,1,1,17,18
2008,Assessment of sexual health in aging men in Europe: Development and validation of the European male ageing study sexual function questionnaire,"O'Connor D.B., Giwercman A., Huhtaniemi I.T., Kula K., O'Neill T.W., Pendleton N., Punab M., Silman A.J., Vanderschueren D., Wu F.C.W., Corona G., Petrone L., Cilotti A., Lean M., Han T., Borghs H., Slowikowska-Hilczer J., Walczak-Jedrzejowska R., Steer P., Ocampo M., Lage M., Forti G., Bartfai G., Foldesi I., Fejes I., Korrovitz P., Jiang M., Tajar A., Pye S., Finn J.D., Bartfai G., Boonen S., Casanueva F.F.",17436095,Journal of Sexual Medicine,5,6,0,0,0,0,3,3
2008,Targeted therapy for adrenocortical tumors in transgenic mice through their LH receptor by Hecate-human chorionic gonadotropin ? conjugate,"Vuorenoja S., Rivero-Muller A., Ziecik A.J., Huhtaniemi I., Toppari J., Rahman N.A.",13510088,Endocrine-Related Cancer,15,2,0,0,1,1,1,2
2008,The gonadotropin receptors FSH-R and LH-R of Atlantic halibut (Hippoglossus hippoglossus)-2. Differential follicle expression and asynchronous oogenesis,"Kobayashi T., Pakarinen P., Torgersen J., Huhtaniemi I., Andersen O.",166480,General and Comparative Endocrinology,156,3,0,0,1,1,2,3
2008,Endogenous testosterone and serum lipids in middle-aged men,"Makinen J.I., Perheentupa A., Irjala K., Pollanen P., Makinen J., Huhtaniemi I., Raitakari O.T.",219150,Atherosclerosis,197,2,0,0,4,4,3,7
2008,Adrenal gland tumorigenesis after gonadectomy in mice is a complex genetic trait driven by epistatic loci,"Bernichtein S., Petretto E., Jamieson S., Goel A., Aitman T.J., Mangion J.M., Huhtaniemi I.T.",137227,Endocrinology,149,2,0,0,2,2,3,5
2008,Oocyte-specific deletion of pten causes premature activation of the primordial follicle pool,"Reddy P., Peng S.L., Lan Z.-J., Cooney A.J., Huhtaniemi I., Liu K., Liu L., Adhikari D., Jagarlamudi K., Rajareddy S., Shen Y., Du C., Tang W., Hamalainen T.",368075,Science,319,5863,0,0,16,16,16,32
2008,Late-onset hypogonadism in men. Experience from the Turku Male Ageing Study (TuMAS).,"Huhtaniemi I., Makinen J.I., Perheentupa A., Raitakari O.T.",11093099,"Hormones (Athens, Greece)",7,1,0,0,0,0,1,1
2008,In vitro bioassays for androgens and their diagnostic applications,"Roy P., Alevizaki M., Huhtaniemi I.",13554786,Human Reproduction Update,14,1,0,0,0,0,1,1
2007,Mutations along the hypothalamic-pituitary-gonadal axis affecting male reproduction,"Huhtaniemi I., Alevizaki M.",14726483,Reproductive BioMedicine Online,15,6,0,0,1,1,0,1
2007,Sexual Symptoms in Aging Men Indicate Poor Life Satisfaction and Increased Health Service Consumption,"Makinen J.I., Perheentupa A., Raitakari O.T., Koskenvuo M., Pollanen P., Makinen J., Huhtaniemi I.",904295,Urology,70,6,0,0,0,0,0,0
2007,Does the andropause exist?,"Perheentupa A., Huhtaniemi I.",17458366,Nature Clinical Practice Endocrinology and Metabolism,3,10,0,0,1,1,1,2
2007,Delay of postnatal maturation sensitizes the mouse prostate to testosterone-induced pronounced hyperplasia: Protective role of estrogen receptor-?,"Savolainen S., Pakarainen T., Huhtaniemi I., Poutanen M., Makela S.",29440,American Journal of Pathology,171,3,0,0,0,0,2,2
2007,Sexual dimorphism in superantigen shock involves elevated TNF-? and TNF-?-induced hepatic apoptosis,"Faulkner L., Altmann D.M., Ellmerich S., Huhtaniemi I., Stamp G., Sriskandan S.",1073449X,American Journal of Respiratory and Critical Care Medicine,176,5,0,0,3,3,1,4
2007,"Human Chorionic Gonadotropin (hCG) up-regulates wnt5b and wnt7b in the mammary gland, and hCG? transgenic female mice present with mammary gland tumors exhibiting characteristics of the Wnt/?-catenin pathway activation","Kuorelahti A., Rulli S., Huhtaniemi I., Poutanen M.",137227,Endocrinology,148,8,0,0,1,1,1,2
2007,Effect of bisphenol A on human chorionic gonadotrophin-stimulated gene expression of cultured mouse Leydig tumour cells,"Takamiya M., Lambard S., Huhtaniemi I.T.",8906238,Reproductive Toxicology,24,2,0,0,0,0,0,0
2007,Male pheromone-stimulated neurogenesis in the adult female brain: Possible role in mating behavior,"Mak G.K., Enwere E.K., Gregg C., Pakarainen T., Poutanen M., Huhtaniemi I., Weiss S.",10976256,Nature Neuroscience,10,8,0,2,13,15,13,28
2007,"Bfk, a novel member of the Bcl2 gene family, is highly expressed in principal cells of the mouse epididymis and demonstrates a predominant nuclear localization","Pujianto D.A., Damdimopoulos A.E., Sipila P., Jalkanen J., Huhtaniemi I., Poutanen M.",137227,Endocrinology,148,7,0,0,1,1,0,1
2007,Role of central nervous system and ovarian insulin receptor substrate 2 signaling in female reproductive function in the mouse,"Neganova I., Bloom S.R., Franks S., Huhtaniemi I., Hardy K., Withers D.J., Al-Qassab H., Heffron H., Selman C., Choudhury A.I., Lingard S.J., Diakonov I., Patterson M., Ghatei M.",63363,Biology of Reproduction,76,6,0,1,0,1,2,3
2007,Assisted large fragment insertion by Red/ET-recombination (ALFIRE) - An alternative and enhanced method for large fragment recombineering,"Rivero-Muller A., Lajic S., Huhtaniemi I.",3051048,Nucleic Acids Research,35,10,0,0,2,2,2,4
2007,Use of hecate-chorionic gonadotropin ? conjugate in therapy of lutenizing hormone receptor expressing gonadal somatic cell tumors,"Rivero-Muller A., Vuorenoja S., Tuominen M., Waclawik A., Brokken L.J.S., Ziecik A.J., Huhtaniemi I., Rahman N.A.",3037207,Molecular and Cellular Endocrinology,269, 1-2,0,0,1,1,0,1
2007,Extragonadal LH/hCG action-Not yet time to rewrite textbooks,"Pakarainen T., Ahtiainen P., Zhang F.-P., Rulli S., Poutanen M., Huhtaniemi I.",3037207,Molecular and Cellular Endocrinology,269, 1-2,0,0,3,3,1,4
2007,"Adrenocortical tumorigenesis, luteinizing hormone receptor and transcription factors GATA-4 and GATA-6","Vuorenoja S., Rivero-Muller A., Kiiveri S., Bielinska M., Heikinheimo M., Wilson D.B., Huhtaniemi I.T., Rahman N.A.",3037207,Molecular and Cellular Endocrinology,269, 1-2,0,1,3,4,3,7
2007,GATA transcription factors in adrenal development and tumors,"Parviainen H., Kiiveri S., Bielinska M., Rahman N., Huhtaniemi I.T., Wilson D.B., Heikinheimo M.",3037207,Molecular and Cellular Endocrinology,265-266, ,0,1,2,3,3,6
2007,Phenotypic characterisation of mice with exaggerated and missing LH/hCG action,"Ahtiainen P., Rulli S., Pakarainen T., Zhang F.-P., Poutanen M., Huhtaniemi I.",3037207,Molecular and Cellular Endocrinology,260-262, ,0,0,3,3,2,5
2006,Angiogenic activity of human chorionic gonadotropin through LH receptor activation on endothelial and epithelial cells of the endometrium.,"Berndt S., Corvol P., van den Brule F., Frankenne F., Poutanen M., Huhtaniemi I., Geenen V., Noel A., Foidart J.M., Perrier d'Hauterive S., Blacher S., Pequeux C., Lorquet S., Munaut C., Applanat M., Herve M.A., Lamande N.",15306860,The FASEB journal : official publication of the Federation of American Societies for Experimental Biology,20,14,0,2,3,5,0,5
2006,"Human homologs of the putative G protein-coupled membrane progestin receptors (mPR?, ?, and ?) localize to the endoplasmic reticulum and are not activated by progesterone","Krietsch T., Fernandes M.S., Kero J., Losel R., Heyens M., Lam E.W.-F., Huhtaniemi I., Brosens J.J., Gellersen B.",8888809,Molecular Endocrinology,20,12,0,12,15,27,6,33
2006,Gonadotrophin resistance,"Huhtaniemi I., Alevizaki M.",1521690X,Best Practice and Research: Clinical Endocrinology and Metabolism,20,4,0,1,2,3,2,5
2006,Angiogenic activity of human chorionic gonadotropin through LH receptor activation on endothelial and epithelial cells of the endometrium,"Berndt S., Corvol P., Van Den Brule F., Frankenne F., Poutanen M., Huhtaniemi I., Geenen V., Noel A., Foidart J.-M., D'Hauterive S.P., Blacher S., Pequeux C., Lorquet S., Munaut C., Applanat M., Herve M.A., Lamande N.",8926638,FASEB Journal,20,14,0,3,0,3,3,6
2006,Novel epididymal protease inhibitors with Kazal or WAP family domain,"Jalkanen J., Kotimaki M., Huhtaniemi I., Poutanen M.",0006291X,Biochemical and Biophysical Research Communications,349,1,0,1,1,2,2,4
2006,Determination of androgen bioactivity in human serum samples using a recombinant cell based in vitro bioassay,"Roy P., Franks S., Read M., Huhtaniemi I.T.",9600760,Journal of Steroid Biochemistry and Molecular Biology,101,1,0,1,4,5,2,7
2006,Differential endocrine regulation of genes enriched in initial segment and distal caput of the mouse epididymis as revealed by genome-wide expression profiling,"Sipila P., Pujianto D.A., Shariatmadari R., Nikkila J., Lehtoranta M., Huhtaniemi I.T., Poutanen M.",63363,Biology of Reproduction,75,2,1,6,2,8,2,11
2006,Mutations along the pituitary-gonadal axis affecting sexual maturation: Novel information from transgenic and knockout mice,Huhtaniemi I.,3037207,Molecular and Cellular Endocrinology,254-255, ,0,2,3,5,1,6
2006,Genetically modified mouse models in studies of luteinising hormone action,"Huhtaniemi I., Ahtiainen P., Pakarainen T., Rulli S.B., Zhang F.-P., Poutanen M.",3037207,Molecular and Cellular Endocrinology,252, 1-2,0,0,1,1,1,2
2006,"Erratum: Suppression of gonadotropins inhibits gonadal tumorigenesis in mice transgenic for the mouse inhibin ?-subunit promoter/simian virus 40 T-antigen fusion gene (Endocrinology (1997) 138, (3521-3531))",Huhtaniemi I.,137227,Endocrinology,147,7,0,0,0,0,0,0
2006,The adrenal gland may be a target of LH action in postmenopausal women,"Alevizaki M., Saltiki K., Mantzou E., Anastasiou E., Huhtaniemi I.",8044643,European Journal of Endocrinology,154,6,0,1,5,6,0,6
2006,Identification of novel epididymal genes by expression profiling and in silico gene discovery,"Jalkanen J., Shariatmadari R., Pujianto D.A., Sipila P., Huhtaniemi I., Poutanen M.",3037207,Molecular and Cellular Endocrinology,250, 1-2,1,0,0,0,2,3
2006,Transgenic mice expressing p450 aromatase as a model for male infertility associated with chronic inflammation in the testis,"Li X., Strauss L., Kaatrasalo A., Mayerhofer A., Huhtaniemi I., Santti R., Makela S., Poutanen M.",137227,Endocrinology,147,3,2,1,5,6,3,11
2006,Molecular mechanisms of insulin-like growth factor-I mediated regulation of the steroidogenic acute regulatory protein in mouse leydig cells,"Manna P.R., Chandrala S.P., King S.R., Jo Y., Counis R., Huhtaniemi I.T., Stocco D.M.",8888809,Molecular Endocrinology,20,2,3,9,8,17,7,27
2006,Both testosterone and follicle-stimulating hormone independently inhibit spermatogonial differentiation in irradiated rats,"Shetty G., Weng C.C.Y., Meachem S.J., Bolden-Tiller O.U., Zhang Z., Pakarinen P., Huhtaniemi I., Meistrich M.L.",137227,Endocrinology,147,1,1,1,2,3,2,6
2005,Fetal but not adult Leydig cells are susceptible to adenoma formation in response to persistently high hCG level: A study on hCG overexpressing transgenic mice,"Ahtiainen P., Rulli S.B., Shariatmadari R., Pelliniemi L.J., Toppari J., Poutanen M., Huhtaniemi I.T.",9509232,Oncogene,24,49,4,7,0,7,1,12
2005,Knockout of luteinizing hormone receptor abolishes the effects of follicle-stimulating hormone on preovulatory maturation and ovulation of mouse graafian follicles,"Pakarainen T., Zhang F.-P., Nurmi L., Poutanen M., Huhtaniemi I.",8888809,Molecular Endocrinology,19,10,7,7,4,11,2,20
2005,Regulated expression of putative membrane progestin receptor homologues in human endometrium and gestational tissues,"Fernandes M.S., Allen J., Brosens J.J., Pierron V., Michalovich D., Astle S., Thornton S., Peltoketo H., Lam E.W.-F., Gellersen B., Huhtaniemi I.",220795,Journal of Endocrinology,187,1,4,10,10,20,4,28
2005,Does variant luteinizing hormone (V-LH) predispose to improper testicular position in late pregnancy?,"Kaleva M., Virtanen H., Haavisto A.-M., Main K., Skakkebaek N.E., Huhtaniemi I., Irjala K., Toppari J.",313998,Pediatric Research,58,3,0,3,2,5,1,6
2005,Focus on gonadotrophin signalling,Huhtaniemi I.,14701626,Reproduction,130,3,0,0,0,0,1,1
2005,The effects of chemicals on mammalian fertility,"Bremer S., Liminga U., Smitz J., Spano M., Themmen A., Tilloy A., Waalkens-Behrends I., Balduzzi D., Cortvrindt R., Daston G., Eletti B., Galli A., Huhtaniemi I., Laws S., Lazzari G.",2611929,ATLA Alternatives to Laboratory Animals,33,4,0,3,4,7,0,7
2005,Novel concepts of human chorionic gonadotropin: Reproductive system interactions and potential in the management of infertility,"Filicori M., Fazleabas A.T., Huhtaniemi I., Licht P., Rao Ch.V., Tesarik J., Zygmunt M.",150282,Fertility and Sterility,84,2,13,18,7,25,4,42
2005,Human FSH? subunit gene is highly conserved,"Lamminen T., Jokinen P., Jiang M., Pakarinen P., Simonsen H., Huhtaniemi I.",13609947,Molecular Human Reproduction,11,8,0,1,1,2,2,4
2005,Discovery and characterization of new epididymis-specific beta-defensins in mice,"Jalkanen J., Huhtaniemi I., Poutanen M.",1674781,Biochimica et Biophysica Acta - Gene Structure and Expression,1730,1,2,2,0,2,0,4
2005,Fertility in luteinizing hormone receptor-knockout mice after wild-type ovary transplantation demonstrates redundancy of extragonadal luteinizing hormone action,"Pakarainen T., Zhang F.-P., Poutanen M., Huhtaniemi I.",219738,Journal of Clinical Investigation,115,7,5,6,1,7,0,12
2005,Targeted ablation of prostate carcinoma cells through LH receptor using hecate-CG? conjugate: Functional characteristic and molecular mechanism of cell death pathway,"Bodek G., Kowalczyk A., Waclawik A., Huhtaniemi I., Ziecik A.J.",15353702,Experimental Biology and Medicine,230,6,2,5,1,6,1,9
2005,Increased carotid atherosclerosis in andropausal middle-aged men,"Makinen J., Jarvisalo M.J., Pollanen P., Perheentupa A., Irjala K., Koskenvuo M., Makinen J., Huhtaniemi I., Raitakari O.T.",7351097,Journal of the American College of Cardiology,45,10,7,5,12,17,8,32
2005,Mouse cysteine-rich secretory protein 4 (CRISP4): A member of the Crisp family exclusively expressed in the epididymis in an androgen-dependent manner,"Jalkanen J., Huhtaniemi I., Poutanen M.",63363,Biology of Reproduction,72,5,8,7,11,18,3,29
2005,A novel targeted therapy of Leydig and granulosa cell tumors through the luteinizing hormone receptor using a hecate-chorionic gonadotropin ? conjugate in transgenic mice,"Bodek G., Vierre S., Rivero-Muller A., Huhtaniemi I., Ziecik A.J., Rahman N.A.",15228002,Neoplasia,7,5,3,7,1,8,2,13
2005,Age-related androgen receptor polymorphisms and responsiveness (multiple letters),"Dickerman R.D., Zachariah N.Y., McConathy W.J., Jiang M., Huhtaniemi I.",5315565,Experimental Gerontology,40,5,0,0,0,0,0,0
2005,Multiple sites of tumorigenesis in transgenic mice overproducing hCG,"Huhtaniemi I., Rulli S., Ahtiainen P., Poutanen M.",3037207,Molecular and Cellular Endocrinology,234, 1-2,5,2,2,4,1,10
2005,Mutations in human gonadotropin and gonadotropin-receptor genes,"Huhtaniemi I.T., Themmen A.P.N.",0969711X,Endocrine,26,3,8,8,3,11,5,24
2005,A multicenter phase IIb study of a novel combination of intramuscular androgen (testosterone decanoate) and oral progestogen (etonogestrel) for male hormonal contraception,"Hay C.J., Devroey P., Huhtaniemi I., Kersemaekers W.M., Brady B.M., Zitzmann M., Osmanagaoglu K., Pollanen P., Apter D., Wu F.C.W., Anderson R.A., Nieschlag E.",0021972X,Journal of Clinical Endocrinology and Metabolism,90,4,13,1,5,6,0,19
2005,Testosterone replacement therapy induces spermatogenesis and partially restores fertility in luteinizing hormone receptor knockout mice,"Pakarainen T., Zhang F.-P., Makela S., Poutanen M., Huhtaniemi I.",137227,Endocrinology,146,2,5,7,2,9,1,15
2004,Testicular cell lines,"Rahman N.A., Huhtaniemi I.T.",3037207,Molecular and Cellular Endocrinology,228, 1-2,3,1,0,1,0,4
2004,Indirect sertoli cell-mediated ablation of germ cells in mice expressing the inhibin-? promoter/herpes simplex virus thymidine kinase transgene,"Ahtiainen M., Toppari J., Poutanen M., Huhtaniemi I.",63363,Biology of Reproduction,71,5,1,0,0,0,0,1
2004,Polymorphisms in androgen and estrogen receptor genes: Effects on male aging,"Jiang M., Huhtaniemi I.",5315565,Experimental Gerontology,39, 11-12,3,2,0,2,0,5
2004,Transgenic and knockout mouse models for aberrant pituitary-testicular function: Relevance to the pathogenesis of cryptorchidism,"Huhtaniemi I., Poutanen M.",414301,Turkish Journal of Pediatrics,46, ,0,2,0,2,0,2
2004,Adrenocortical tumorigenesis in transgenic mice expressing the inhibin ?-subunit promoter/simian virus 40 T-antigen transgene: Relationship between ectopic expression of luteinizing hormone receptor and transcription factor GATA-4,"Rahman N.A., Kiiveri S., Rivero-Muller A., Levallet J., Vierre S., Kero J., Wilson D.B., Heikinheimo M., Huhtaniemi I.",8888809,Molecular Endocrinology,18,10,7,6,4,10,1,18
2004,Absence of the genetic variant Val79Met in human chorionic gonadotropin-beta gene 5 in five European populations,"Jiang M., Savontaus M.-L., Simonsen H., Williamson C., Mullenbach R., Gromoll J., Terwort N., Alevizaki M., Huhtaniemi I.",13609947,Molecular Human Reproduction,10,10,3,0,2,2,0,5
2004,Effects of medroxyprogesterone and estradiol on the recovery of spermatogenesis in irradiated rats,"Shetty G., Weng C.C.Y., Bolden-Tiller O.U., Huhtaniemi I., Handelsman D.J., Meistrich M.L.",137227,Endocrinology,145,10,3,2,1,3,1,7
2004,Influence of mutations affecting gonadotropin production or responsiveness on expression of inhibin subunit mRNA and protein in the mouse ovary,"Hirst R.C., Abel M.H., Wilkins V., Simpson C., Knight P.G., Zhang F.-P., Huhtaniemi I., Kumar T.R., Charlton H.M.",14701626,Reproduction,128,1,5,2,1,3,1,9
2004,Detection of hCG responsive expression of the steroidogenic acute regulatory protein in mouse leydig cells,"Manna P.R., Huhtaniemi I.T., Stocco D.M.",14809222,Biological Procedures Online,6,1,4,5,3,8,2,14
2004,Orexin A and B levels in the hypothalamus of female rats: The effects of the estrous cycle and age,"Porkka-Heiskanen T., Kalinchuk A., Alanko L., Huhtaniemi I., Stenberg D.",8044643,European Journal of Endocrinology,150,5,7,6,1,7,1,15
2004,Complete sertoli cell proliferation induced by follicle-stimulating hormone (FSH) independently of luteinizing hormone activity: Evidence from genetic models of isolated FSH action,"Allan C.M., Garcia A., Spaliviero J., Zhang F.-P., Jimenez M., Huhtaniemi I., Handelsman D.J.",137227,Endocrinology,145,4,19,4,3,7,2,28
